Sentences,Source
Our quantitative research provides longitudinal data showcasing the trend of increasing global temperatures.,Academic
The hypothesis proposed was that transitioning to renewable energy sources would result in a significant decrease in carbon emissions.,Academic
"In this scenario, the projection model indicates potential anomalies in solar and wind energy outputs.",Academic
Findings from our regression analysis suggest a strong correlation between deforestation and the rise in atmospheric carbon dioxide levels.,Academic
The peer-review process for this research revealed a high correlation between methane levels and industrial pollution.,Academic
"Through a comprehensive sample of global data, we examined the impact of renewable energy transition on overall emissions.",Academic
This study underlines the significance of immediate action to enhance sustainability efforts to mitigate the effects of global warming.,Academic
Our analysis indicated a major trend in temperature rises concurrent with increases in greenhouse gases.,Academic
"This research scenario envisages a global shift towards renewable energy sources, like solar and wind, and its potential impact on carbon dioxide levels.",Academic
"Post peer-review, our revised hypothesis suggests an urgent transition to renewable sources to limit global warming.",Academic
"Given the recent rise in deforestation rates, our findings highlight the urgent need for sustainable practices.",Academic
"This research, which has received numerous citations, discusses the impact of hydro power on global emissions.",Academic
Quantitative assessment of a diverse global sample revealed a clear trend in renewable energy adoption.,Academic
"Our hypothesis focused on the potential of solar power to reduce emissions, with our regression analysis confirming this.",Academic
Longitudinal studies have shown that the transition to wind power can play a pivotal role in achieving global sustainability.,Academic
"Anomalies in temperature data were noted in the peer-review process, hinting at the growing impact of greenhouse gases.",Academic
The study highlights the significance of renewable energy sources in combating global warming.,Academic
Our findings underscored the crucial role of deforestation in altering carbon dioxide levels.,Academic
The scenario in our research demonstrated the relationship between methane release and pollution.,Academic
The trend toward increased global temperatures became evident after an extensive review of the sample data.,Academic
Citations in our research from various peer-reviewed sources point to a shift towards a global renewable energy transition.,Academic
Our regression analysis postulated a significant correlation between carbon emissions and rising global temperatures.,Academic
The anomalies identified in our peer-reviewed research indicate a disruption in the natural atmospheric balance due to greenhouse gases.,Academic
Our quantitative research showcases the global trend towards renewable energy sources like wind and solar.,Academic
The significance of our findings lies in understanding the impact of hydro power on emissions.,Academic
The revised hypothesis post peer-review highlighted the urgent need for a transition to sustainable practices.,Academic
Our scenario-based analysis revealed a strong correlation between deforestation and methane levels.,Academic
A quantitative analysis of our sample data revealed a clear trend in rising global temperatures.,Academic
Our longitudinal study confirms the benefits of transitioning to renewable energy sources to combat global warming.,Academic
The peer-review process highlighted the impact of global emissions on weather patterns.,Academic
"In our research scenario, an urgent shift towards renewable energy sources like wind and solar was proposed to manage the carbon dioxide levels.",Academic
Our findings from the regression analysis suggested a decrease in carbon emissions with increased usage of renewable energy sources.,Academic
The significance of our research lies in the impact of renewable energy transition on global warming.,Academic
Citations from various researches in our study emphasized the impact of deforestation on atmospheric carbon dioxide levels.,Academic
The anomalies identified in global temperatures during our longitudinal study indicate the urgent need for sustainable practices.,Academic
The peer-reviewed findings suggest a clear correlation between increased methane levels and industrial pollution.,Academic
The hypothesis of our study was that a global shift towards renewable energy sources could significantly mitigate global warming.,Academic
Our scenario-based approach revealed that sustainable practices can reduce the impact of greenhouse gases on global temperatures.,Academic
The peer-review process highlighted the correlation between the transition to renewable energy and a decrease in carbon emissions.,Academic
"Our research, based on a comprehensive sample of global data, emphasized the increasing trend of sustainability in energy production.",Academic
Citations in our research underscored the significance of an immediate shift towards renewable energy to combat the impact of global warming.,Academic
The quantitative findings of our research propose an urgent need to control deforestation for a sustainable future.,Academic
Our longitudinal research presents quantitative data illuminating the increasing trend of global warming.,Academic
Our hypothesis assumes that embracing renewable energy sources could lead to a marked reduction in global carbon emissions.,Academic
"In this experimental scenario, our models forecast unexpected anomalies in energy outputs from solar and wind sources.",Academic
The results from our regression analysis illustrate a substantial correlation between rates of deforestation and increases in atmospheric carbon dioxide.,Academic
The peer-review phase of our study confirmed a strong link between rising methane levels and industrial pollution worldwide.,Academic
"Utilizing a diverse global sample, our research scrutinizes the effects of transitioning to renewable energy on overall emissions.",Academic
The findings of our study underscore the significance of swift action to boost sustainability and curb the impacts of global warming.,Academic
Our in-depth analysis points out a substantial trend in rising temperatures in line with an increase in greenhouse gas emissions.,Academic
"This study's scenario foresees a worldwide adoption of renewable energy sources, such as solar and wind, and their potential effect on carbon dioxide concentration.",Academic
"After undergoing peer-review, our revised hypothesis advocates for an expedited shift to renewable energy to mitigate global warming.",Academic
"In light of escalating deforestation rates, our study emphasizes the crucial need for sustainable measures.",Academic
Our well-cited research paper discusses the influence of hydro power on global emission figures.,Academic
Longitudinal studies have provided quantitative data supporting the increasing trend of carbon emissions.,Academic
The research hypothesis posits that a transition to renewable energy could significantly reduce methane levels.,Academic
"In our model scenario, we predict potential anomalies in the sustainability of wind and solar energy.",Academic
Regression analysis findings have highlighted a correlation between the increase in deforestation and atmospheric pollution.,Academic
The peer-review of this research identified a correlation between greenhouse gases and global warming trends.,Academic
"Through extensive sampling of global data, we study the impact of the renewable energy transition on atmospheric carbon dioxide.",Academic
The study accentuates the significance of immediate action towards renewable energy to mitigate warming effects.,Academic
Our trend analysis revealed a steady rise in temperature aligned with increasing greenhouse gas emissions.,Academic
The proposed research scenario predicts a global shift to renewable energy sources impacting carbon dioxide levels.,Academic
"Upon peer-review, our hypothesis suggests a pressing transition to renewable energy sources to curb global warming.",Academic
"Considering the recent surge in deforestation, the study's findings underscore the urgency for sustainable solutions.",Academic
"The cited research discusses the influence of renewable energy sources such as hydro, wind, and solar on global emissions.",Academic
Quantitative data from our longitudinal study suggest a concerning trend in global warming.,Academic
The hypothesis infers a significant drop in carbon emissions upon transitioning to renewable energy sources.,Academic
"In this research scenario, we indicate possible anomalies in wind and solar energy outputs.",Academic
Our regression analysis findings suggest a robust correlation between deforestation and rising carbon dioxide.,Academic
"Our findings, post peer-review, have exposed a strong association between methane levels and industrial pollution.",Academic
The study's significance lies in the urgent enhancement of sustainability efforts to mitigate global warming's impact.,Academic
Longitudinal studies affirm the trend of renewable energy having a significant impact on reducing global emissions.,Academic
This research scenario predicts the global transition to wind and solar power leading to a significant decrease in carbon dioxide.,Academic
Our quantitative hypothesis suggests a strong correlation between carbon emissions and deforestation.,Academic
The peer-review process has emphasized the need for urgent sustainability practices to combat global warming.,Academic
"Our sample size encompassed several regions impacted by global warming, all showing the positive effects of a renewable energy transition.",Academic
Findings from the regression analysis highlight a significant correlation between global warming and methane emissions.,Academic
"In a scenario of increased renewable energy usage, we observed fewer anomalies in weather patterns.",Academic
The trend of increased solar and wind energy adoption is evident in our longitudinal study.,Academic
The significance of transitioning to renewable energy cannot be understated given the potential for reduced carbon emissions.,Academic
"Post peer-review, our research proposes an immediate switch to renewable energy to limit temperature increases.",Academic
"Our hypothesis, revised after rigorous peer-review, links global emissions to deforestation.",Academic
Citation of our research has grown as we continue to highlight the impact of greenhouse gases on global warming.,Academic
Longitudinal trends indicate a decrease in global emissions following the transition to renewable energy.,Academic
A quantitative approach in our research scenario has provided insights into the anomalies of solar and wind energy outputs.,Academic
"Following a rigorous peer-review process, our research on global warming and its correlation with carbon emissions was published.",Academic
The hypothesis we have proposed involves using a comprehensive global sample to study the impact of hydro power on overall emissions.,Academic
Our regression analysis findings suggest a significant trend in temperature rise linked with increased greenhouse gases.,Academic
This scenario demonstrates the potential of a global shift to renewable energy sources in reducing carbon emissions.,Academic
"Given the trend in temperature increases, our findings emphasize the urgent need for sustainability practices.",Academic
"Anomalies in the global climate have been extensively studied in our research, emphasizing the need for renewable energy transition.",Academic
This peer-reviewed study shows the correlation between renewable energy sources and a reduction in carbon dioxide levels.,Academic
"In a world grappling with the effects of global warming, the significance of transitioning to renewable energy is paramount.",Academic
The projection model used in this research scenario suggests a substantial decrease in emissions through the use of solar and wind energy.,Academic
Our findings underline the importance of immediate action against deforestation to mitigate the rising levels of greenhouse gases.,Academic
"The trend of renewable energy adoption, if continued, can significantly impact global warming as per our hypothesis.",Academic
Citations of our research on sustainability and its effects on temperature control are on the rise.,Academic
"The research scenario demonstrates the potential impact of renewable energy adoption, particularly solar and wind, on carbon emissions.",Academic
Our longitudinal study clearly indicates a positive trend in temperature control due to renewable energy transition.,Academic
"Post peer-review, our research emphasizes the critical role of hydro power in global emissions control.",Academic
Findings from our regression analysis suggest a potential correlation between methane levels and industrial pollution.,Academic
The hypothesis developed in this research underscores the importance of renewable energy in curbing global emissions.,Academic
Our analysis signifies that combating global warming requires a strategic shift towards sustainability and renewable energy.,Academic
"Our research, which has been widely cited, discusses the correlation between greenhouse gases and global warming trends.",Academic
The findings of our research indicate the need for urgent action on sustainability measures to mitigate global warming.,Academic
The peer-review process for our study on global warming highlighted the urgent need for a transition to renewable energy sources.,Academic
"This quantitative study, based on a longitudinal dataset, reveals a trend of rising global temperatures and related emissions.",Academic
Our central hypothesis states that a transition to renewable energy would lead to a notable reduction in carbon emissions.,Academic
"Using our projection model, we simulate a scenario where anomalies occur in the output of wind and solar energy.",Academic
The findings of our regression analysis imply a strong relationship between deforestation and the increase in carbon dioxide in the atmosphere.,Academic
The peer-review process highlighted a significant correlation between industrial pollution and increasing methane levels.,Academic
We scrutinized a large sample of global data to assess the impact of the transition to renewable energy on overall emissions.,Academic
The study underscores the significance of taking prompt action to enhance sustainability efforts to combat global warming.,Academic
Our trend analysis revealed a direct relationship between temperature increases and rising levels of greenhouse gases.,Academic
"The research scenario predicts the potential impact of a global shift towards renewable energy sources, such as wind and solar, on carbon dioxide levels.",Academic
"After the peer-review stage, our updated hypothesis advocates for an expedited transition to renewable energy to curb global warming.",Academic
"With the alarming rate of deforestation, our findings underscore the immediate need for implementing sustainable practices.",Academic
Our heavily cited research provides an in-depth discussion on the impact of hydro power on global emissions.,Academic
"In the quantitative assessment of our longitudinal study, a clear trend emerged showing the benefits of renewable energy for reducing global emissions.",Academic
Our hypothesis postulates that the global transition to renewable energy will have a significant impact on reducing carbon emissions.,Academic
"In the modeled scenario, we detected potential anomalies in the generation of solar and wind energy.",Academic
The regression analysis findings suggest a strong link between deforestation rates and the rise of atmospheric carbon dioxide levels.,Academic
"Through a rigorous peer-review process, we established a correlation between methane emissions and industrial pollution.",Academic
"Our study, focusing on a comprehensive global sample, examines the impact of the renewable energy transition on greenhouse gas emissions.",Academic
Our findings underline the significance of immediate and robust actions towards sustainability to mitigate the severe effects of global warming.,Academic
The trend analysis indicated a consistent rise in temperature associated with increases in greenhouse gases.,Academic
"This research scenario envisages the potential impact of transitioning to renewable energy sources, like solar and wind, on the global carbon dioxide levels.",Academic
"Following the peer-review process, our updated hypothesis insists on a swift transition to renewable energy to combat global warming.",Academic
"Given the recent acceleration in deforestation, our findings emphasize the need for sustainable practices.",Academic
"Our research, which has received numerous citations, delves into the impact of hydroelectric power on global emissions.",Academic
The quantitative analysis from our longitudinal data suggests a global trend of increasing temperatures due to higher emissions.,Academic
Our hypothesis suggests a global transition to renewable energy sources would significantly curb carbon emissions.,Academic
"In this scenario, potential anomalies in the productivity of solar and wind energy are revealed.",Academic
The findings from our regression analysis show a correlation between increased deforestation and atmospheric carbon dioxide levels.,Academic
The peer-review process has shown a direct link between industrial pollution and methane emissions.,Academic
"Through analyzing a comprehensive global sample, we explore the impact of transitioning to renewable energy on overall emissions.",Academic
This study stresses the significance of swift actions towards sustainability to lessen the effects of global warming.,Academic
Our analysis reveals a growing trend in temperature rises alongside increases in greenhouse gases.,Academic
"The research scenario projects the global shift towards renewable energy sources, and its potential impact on carbon dioxide levels.",Academic
"Following peer-review, our revised hypothesis underscores the need for an urgent transition to renewable sources to minimize global warming.",Academic
"Our findings emphasize the importance of sustainable practices, especially in light of recent increases in deforestation rates.",Academic
Longitudinal studies showcase the trend of the global shift towards renewable energy sources.,Academic
Our quantitative assessment highlights the sustainability challenges in the face of global warming.,Academic
A proposed hypothesis posits that transitioning to wind energy would significantly reduce carbon emissions.,Academic
Potential anomalies in renewable energy adoption were highlighted in our modeled scenario.,Academic
Our regression analysis uncovers findings of a strong correlation between increased methane and pollution levels.,Academic
The sample data reveals a distinct trend of rising global temperatures and their link to greenhouse gases.,Academic
The peer-review process underscored the significance of immediate transition to renewable energy sources to curb emissions.,Academic
This research scenario explores the impact of a rapid transition to solar power on global warming.,Academic
The research's key findings stress the role of deforestation in exacerbating carbon dioxide levels.,Academic
"Post peer-review, our hypothesis underlines the critical need for sustainable practices to mitigate global warming.",Academic
"Through a comprehensive quantitative analysis, the trend of carbon dioxide levels alongside global temperature increases is identified.",Academic
This highly-cited research underlines the potential of wind power in reducing global emissions.,Academic
Anomalies in temperature increases suggest a correlation with escalating greenhouse gas emissions.,Academic
Our hypothesis anticipates significant carbon reductions with a global shift towards hydro power.,Academic
The peer-reviewed research affirms the urgent need for a transition to renewable energy to combat global warming.,Academic
The regression analysis reveals the potential impact of increased solar and wind energy adoption on carbon dioxide levels.,Academic
Findings from our sample data demonstrate the role of renewable energy transition in mitigating pollution.,Academic
Our longitudinal study showcases a global trend towards sustainability in energy consumption.,Academic
"Cited extensively, this research underscores the implications of deforestation on climate anomalies.",Academic
"In this scenario, the hypothesis proposes a correlation between atmospheric methane and industrial pollution.",Academic
The peer-review process emphasized the significance of our findings linking renewable energy to reduced emissions.,Academic
A regression analysis of our sample data highlights the potential of renewable energy in slowing global warming.,Academic
The study identifies trends in global temperature increases alongside the rise of greenhouse gases.,Academic
The quantitative research underscores the impact of a transition to renewable energy on carbon emissions.,Academic
This research scenario examines the effects of increased solar power adoption on global warming.,Academic
Our hypothesis post peer-review suggests the potential of wind energy in reducing global emissions.,Academic
"Longitudinally, the trend of rising global temperatures corresponds to increased greenhouse gas emissions.",Academic
"The research, which has received multiple citations, investigates the impact of renewable energy sources on climate anomalies.",Academic
Anomalies in the data suggest a correlation between renewable energy transition and a reduction in carbon dioxide levels.,Academic
Our quantitative analysis of the sample data reveals a growing trend of deforestation globally.,Academic
The findings of our regression analysis indicate the significance of adopting sustainable practices in mitigating climate change.,Academic
Our hypothesis suggests that a global transition to hydro power could play a significant role in reducing emissions.,Academic
"Following a rigorous peer-review process, our findings demonstrate a correlation between renewable energy adoption and decreased pollution.",Academic
The longitudinal study provides quantitative data illustrating the trend of increased carbon dioxide levels with global warming.,Academic
The research scenario posits that a significant shift towards solar and wind energy could reduce global emissions.,Academic
